show_id,type,title,director,cast,country,date_added,release_year,rating,duration,listed_in,description,movie_title,release_date,genre,mpaa_rating,total_gross,inflation_adjusted_gross
s1151,Movie,Queen of Katwe,Mira Nair,"David Oyelowo, Lupita Nyong'o, Madina Nalwanga, Martin Kabanza, Taryn Kyaze, Esther Tebandeke",United States,"November 12, 2019",2016.0,PG,125 min,"Biographical, Drama, Sports",A Ugandan girl’s life changes forever when she discovers she has an amazing talent for chess.,,,,,,
s1152,Movie,Quints,Bill Corcoran,"Kimberly Brown, Daniel Roebuck, Elizabeth Morehead, Shadia Simmons, Jake Epstein, Vince Corazza","Canada, United States","November 12, 2019",2000.0,TV-G,83 min,"Comedy, Coming of Age",Jamie is the center of attention until her mom gives birth to quintuplets.,,,,,,
s1153,Movie,Ratatouille,Brad Bird,"Patton Oswalt, Ian Holm, Lou Romano, Brian Dennehy, Peter Sohn, Peter O'Toole",United States,"November 12, 2019",2007.0,G,111 min,"Animation, Comedy, Family",A determined young rat dreams of becoming a French chef.,,,,,,
s1154,Movie,Read It and Weep,Paul Hoen,"Kay Panabaker, Jason Dolley, Robin Riker, Tom Virtue, Alexandra Krosney, Danielle Panabaker",United States,"November 12, 2019",2006.0,TV-G,85 min,"Comedy, Coming of Age, Drama",Jamie's journal accidentally becomes a best-selling book.,,,,,,
s1155,Movie,Ready to Run,Duwayne Dunham,"Krissy Perez, Jason Dohring, Lillian Hurst, Jon Brazier, Nestor Serrano, Theresa Saldana","United States, New Zealand","November 12, 2019",2000.0,TV-G,89 min,"Animals & Nature, Coming of Age, Family",Corrie dreams of becoming a jockey despite her father's race-related death.,,,,,,
s1156,Movie,Recess: All Growed Down,"Howy Parkins, Chuck Sheetz","Rickey Collins, Jason Davis, Ashley Johnson, Myles Jeffrey, Andrew Lawrence, Ross Malinger",United States,"November 12, 2019",2003.0,G,61 min,"Animation, Comedy, Family",T.J. and the gang are captured by the kindergartners.,,,,,,
s1157,Movie,Recess: School's Out,Chuck Sheetz,"Rickey Collins, Jason Davis, Ashely Johnson, Andy Lawrence, Courtland Mead, Pam Segall","United States, Japan","November 12, 2019",2001.0,G,87 min,"Animation, Comedy, Family",Third Street Elementary students band together to save summer break.,,,,,,
s1158,Movie,Recess: Taking the 5th Grade,Howy Parkins,"Rickey Collins, Jason Davis, Myles Jeffrey, Ashley Johnson, Courtland Mead, Pamela Adlon",United States,"November 12, 2019",2003.0,G,63 min,"Animation, Comedy, Family",The gang graduates to the fifth grade but discovers some unwelcome changes.,,,,,,
s1159,Movie,Red's Dream,John Lasseter,,United States,"November 12, 2019",1987.0,TV-G,4 min,"Animation, Drama, Family","Red, a unicycle, dreams that he steals the show.",,,,,,
s1160,Movie,Remember the Titans,Boaz Yakin,"Denzel Washington, Will Patton, Donald Faison, Wood Harris, Ryan Hurst, Ethan Suplee",United States,"November 12, 2019",2000.0,PG,114 min,"Drama, Historical, Sports",An African-American coach leads a newly integrated high school football team in 1970s Virginia.,,,,,,
s1161,Movie,Rescue Dog,Charles Nichols,,United States,"November 12, 2019",1947.0,TV-G,7 min,"Animation, Comedy, Family",Rescue dog Pluto must deal with a playful seal pup. See details for advisory.,,,,,,
s1162,Movie,Return from Witch Mountain,John Hough,"Bette Davis, Christopher Lee, Kim Richards, Ike Eisenmann, Jack Soo, Anthony James",United States,"November 12, 2019",1978.0,G,94 min,"Action-Adventure, Family, Science Fiction",Sinister masterminds manipulate a boy's supernatural powers for their own devious gain.,,,,,,
s1163,Movie,Return to Halloweentown,David Jackson,"Sara Paxton, Judith Hoag, Lucas Grabeel, J. Zimmerman, Kristy Wu, Keone Young",United States,"November 12, 2019",2006.0,TV-PG,89 min,"Family, Fantasy",Marnie Piper holds the key to Witch University's ultimate secret.,,,,,,
s1164,Movie,Return to Oz,Walter Murch,"Nicol Williamson, Jean Marsh, Piper Laurie, Matt Clark, Fairuza Balk, Michael Sundin","United Kingdom, United States","November 12, 2019",1985.0,PG,110 min,"Action-Adventure, Family, Fantasy",Dorothy battles the wicked Princess Mombi and the evil Nome King to restore the Emerald City.,,,,,,
s1165,Movie,Richie Rich's Christmas Wish,John Murlowski,"David Gallagher, Eugene Levy, Keene Curtis, Jake Richardson, Martin Mull, Lesley Warren",United States,"November 12, 2019",1998.0,G,85 min,"Action-Adventure, Comedy, Family",A wishing machine transports Richie Rich to an alternate universe.,,,,,,
s1166,Movie,Right on Track,Duwayne Dunham,"Beverley Mitchell, Brie Larson, Marcus Toji, Jodi Russell, Jon Lindstrom, Ruby O'Neil",United States,"November 12, 2019",2003.0,TV-G,88 min,"Buddy, Family, Sports",Two sisters fight for their place in male-dominated junior drag racing.,,,,,,
s1167,Movie,Riley’s First Date?,Josh Cooley,"Lori Alan, Carlos Alazraqui, Lewis Black, Josh Cooley, Ben Cox, Kaitlyn Dias",United States,"November 12, 2019",2015.0,G,8 min,"Animation, Comedy, Coming of Age",A boy shows up at Riley's door.,,,,,,
s1168,Movie,Rip Girls,Joyce Chopra,"Camilla Belle, Dwier Brown, Stacie Hess, Brian Stark, Jeanne Mori, Lauren Sinclair","Australia, United States","November 12, 2019",2000.0,TV-G,87 min,"Coming of Age, Drama",Sydney questions a decision to sell her inherited Hawaiian land.,,,,,,
s1169,Movie,Robin Hood,Wolfgang Reitherman,"Roger Miller, Peter Ustinov, Terry-Thomas , Brian Bedford, Monica Evans, Phil Harris",United States,"November 12, 2019",1973.0,G,85 min,"Action-Adventure, Animation, Family",Disney's animated classic tale of England's legendary hero.,,,,,,
s1170,TV Show,Rocky Mountain Animal Rescue,,Chopper Bernet,United States,"November 12, 2019",2018.0,TV-PG,1 Season,"Animals & Nature, Docuseries, Family",Officers and vets in the Pike's Peak area of Colorado handle thousands of animal emergencies a year.,,,,,,
s1171,Movie,Rogue One: A Star Wars Story,Gareth Edwards,"Felicity Jones, Diego Luna, Ben Mendelsohn, Donnie Yen, Mads Mikkelsen, Alan Tudyk",United States,"November 12, 2019",2016.0,PG-13,134 min,"Action-Adventure, Science Fiction",Unlikely heroes band together to steal the plans to the Death Star.,,,,,,
s1172,Movie,Roving Mars,George Butler,"Paul Newman, Steve Squyres, Rob Manning, Dr. Elachi, Wayne Lee",United States,"November 12, 2019",2006.0,G,41 min,"Documentary, Family",Explore the surface of the red planet through the eyes of two NASA rovers.,,,,,,
s1173,Movie,Ruby Bridges,Euzhan Palcy,"Penelope Miller, Kevin Pollak, Michael Beach, Jean Kelly, Peter James, Patrika Darbo",United States,"November 12, 2019",1998.0,TV-PG,90 min,"Biographical, Drama, Historical",A little girl becomes the first African-American to integrate her school.,,,,,,
s1174,Movie,Sacred Planet,Jon Long,"Robert Redford, Arapata McKay, Tsaan Ciqae, Mae Tui, Cy Peck Jr., Mutang Urud","Canada, Malaysia, United States","November 12, 2019",2004.0,G,47 min,"Animals & Nature, Documentary, Family",Visit some of the most exotic and beautiful places still in existence.,,,,,,
s1175,Movie,Saludos Amigos,"Bill Roberts, Jack Kinney, Ham Luske",Fred Shields,United States,"November 12, 2019",1943.0,TV-PG,42 min,"Animation, Comedy, Family",Four animated shorts with Donald Duck and Goofy are set to a samba beat. See details for advisory.,,,,,,
s1176,Movie,"Sammy, The Way-Out Seal",Norman Tokar,"Jack Carson, Robert Culp, Patricia Barry, Elisabeth Fraser, Michael McGreevey, Billy Mummy",United States,"November 12, 2019",1962.0,TV-G,43 min,"Animals & Nature, Comedy, Family",Two young brothers adopt an injured seal…without telling their parents. See details for advisory.,,,,,,
s1177,Movie,Sanjay's Super Team,Sanjay Patel,"Brenton Schraff, Sunny Attar, Arun Rao, Jaquelynn Herrera",United States,"November 12, 2019",2015.0,PG,7 min,"Action-Adventure, Animation, Family",Young Sanjay daydreams of Hindu gods as superheroes.,,,,,,
s1178,Movie,Santa Paws 2: The Santa Pups,Robert Vince,"Cheryl Ladd, George Newbern, Pat Finn, Danny Woodburn, Obba Babatunde, Paul Rae",United States,"November 12, 2019",2012.0,G,92 min,"Fantasy, Musical","When holiday spirit mysteriously begins to disappear, the Santa Pups race to save Christmas.",,,,,,
s1179,Movie,Santa's Workshop,Wilfred Jackson,,United States,"November 12, 2019",1932.0,TV-G,7 min,"Animation, Family, Fantasy",Santa and his elves make toys to deliver on Christmas Eve See details for advisory.,,,,,,
s1180,Movie,Saving Mr. Banks,John Hancock,"Emma Thompson, Tom Hanks, Colin Farrell, Paul Giamatti, Jason Schwartzman, Bradley Whitford","United States, United Kingdom, Australia","November 12, 2019",2013.0,PG-13,129 min,"Biographical, Drama, Historical","Discover the untold story behind Walt Disney's 20-year effort to bring ""Mary Poppins"" to life.",,,,,,
s1181,Movie,Science Fair,"Cristina Costantini, Darren Foster","Anjali Chadha, Ryan Folz, Harsha Paladugu, Abraham Riedel-Mishaan, Kashfia Rahman, Ivo Zell",United States,"November 12, 2019",2018.0,PG,91 min,"Documentary, Family",Nine high school students compete at the International Science and Engineering Fair.,,,,,,
s1182,Movie,Sea of Hope: America's Underwater Treasures,Robert Nixon,Max Kennedy,United States,"November 12, 2019",2017.0,TV-PG,47 min,"Action-Adventure, Animals & Nature, Documentary",Oceanographer Sylvia Earle sets out to inspire the creation of 'blue parks' to protect the ocean.,,,,,,
s1183,Movie,Secret of The Wings,Peggy Holmes,"Mae Whitman, Lucy Hale, Timothy Dalton, Jeff Bennett, Lucy Liu, Raven-Symoné","United States, India, United Kingdom","November 12, 2019",2012.0,G,79 min,"Animation, Fantasy, Kids",Tink crosses into the forbidden Winter Woods and finds she has a sister.,,,,,,
s1184,Movie,Secretariat,Randall Wallace,"Diane Lane, John Malkovich, Dylan Walsh, James Cromwell, Kevin Connolly, Nelsan Ellis",United States,"November 12, 2019",2010.0,PG,124 min,"Animals & Nature, Biographical, Drama","A housewife becomes the unlikely owner of a racehorse, then risks it all to make him a champion.",,,,,,
s1185,Movie,Secrets of Christ's Tomb: Explorer Special,Bob Strange,,United States,"November 12, 2019",2017.0,TV-PG,47 min,"Documentary, Historical",A team of experts races to repair the structure housing Christ’s tomb.,,,,,,
s1186,Movie,Secrets of Life,James Algar,Winston Hibler,United States,"November 12, 2019",1956.0,TV-PG,70 min,"Animals & Nature, Documentary, Family",Discover Mother Nature’s secrets with a look at our ever-evolving planet.,,,,,,
s1187,Movie,Secrets of the King Cobra,,Andre Braugher,India,"November 12, 2019",2012.0,TV-PG,47 min,"Animals & Nature, Documentary",A new scientific expedition follows the king cobra into the wild for the first time.,,,,,,
s1188,TV Show,Shake It Up,,"Bella Thorne, Zendaya , Davis Cleveland, Roshon Fegan, Adam Irigoyen, Kenton Duty",United States,"November 12, 2019",2010.0,TV-G,3 Seasons,"Buddy, Comedy, Coming of Age",Best friends attend high school and dance professionally.,,,,,,
s1189,Movie,Sharks of Lost Island,,Chris McLinden,United States,"November 12, 2019",2013.0,TV-PG,45 min,"Action-Adventure, Animals & Nature, Documentary",A team of explorers sets out to explore the sea and land of the remote Pitcairn Islands.,,,,,,
s1190,Movie,Sharpay's Fabulous Adventure,Michael Lembeck,"Ashley Tisdale, Austin Butler, Cameron Goodman, Bradley Perry, Alec Mapa, Jack Plotnick",United States,"November 12, 2019",2011.0,TV-G,92 min,"Comedy, Coming of Age, Music",Aspiring diva Sharpay leaves suburbia and hits Broadway…and hits it hard.,,,,,,
s1191,Movie,Shipwrecked,Nils Gaup,"Stian Smestad, Trond Peter Munch, Louisa Haigh, Gabriel Byrne, Bjørn Sundquist, Eva von Hanno","Norway, Sweden, United States","November 12, 2019",1991.0,PG,93 min,"Action-Adventure, Coming of Age, Family",A cabin boy must outwit a ruthless gang of pirates while shipwrecked on a jungle island.,,,,,,
s1192,TV Show,Silver Surfer,,"Paul Essiembre, James Blendick, Robert Bockstael, Jennifer Daley, Colin Fox","United States, Canada","November 12, 2019",1997.0,TV-Y7,1 Season,"Action-Adventure, Animation, Kids",The adventures of the cosmic wanderer as he seeks his lost home after rebelling from his master.,,,,,,
s1193,Movie,Simpsons Movie,David Silverman,"Dan Castellaneta, Julie Kavner, Nancy Cartwright, Yeardley Smith, Harry Shearer, Hank Azaria",United States,"November 12, 2019",2007.0,PG-13,88 min,"Action-Adventure, Animation, Comedy",Homer must save the world from a catastrophe he himself created.,,,,,,
s1194,Movie,Sister Act,Emile Ardolino,"Whoopi Goldberg, Maggie Smith, Harvey Keitel, Bill Nunn, Mary Wickes, Kathy Najimy",United States,"November 12, 2019",1992.0,PG,101 min,"Comedy, Crime, Family",A low-rent lounge singer is forced to hide out from the mob in a convent.,,,,,,
s1195,Movie,Sister Act 2: Back in the Habit,Bill Duke,"Whoopi Goldberg, Kathy Najimy, Barnard Hughes, Mary Wickes, James Coburn, Michael Jeter",United States,"November 12, 2019",1993.0,PG,108 min,"Comedy, Family, Music",Deloris goes back undercover to try to save a troubled inner-city school.,,,,,,
s1196,Movie,Skyrunners,Ralph Hemecker,"Kelly Blatz, Joey Pollari, Conrad Coates, Jacqueline Wood, Nathan Stephenson, Kerry Laifatt",United States,"November 12, 2019",2009.0,TV-PG,93 min,"Action-Adventure, Science Fiction",Teen brothers discover a UFO near their town…and learn of an alien plot.,,,,,,
s1197,Movie,Sleeping Beauty,Clyde Geronimi,"Mary Costa, Eleanor Audley, Barbara Luddy, Taylor Holmes, Bill Shirley, Verna Felton",United States,"November 12, 2019",1959.0,G,77 min,"Animation, Family, Fantasy",A fairy-tale classic about a princess saved by true love's kiss.,,,,,,
s1198,Movie,Smart House,LeVar Burton,"Ryan Merriman, Kevin Kilner, Jessica Steen, Katie Volding, Katey Sagal, Emilio Borelli",United States,"November 12, 2019",1999.0,TV-G,82 min,"Comedy, Coming of Age, Drama",A computerized Smart House becomes an overly possessive virtual mother.,,,,,,
s1199,Movie,Smash and Grab,Brian Larsen,,United States,"November 12, 2019",2019.0,PG,8 min,"Animation, Buddy, Family",Two antiquated robots risk everything for freedom and for each other.,,,,,,
s1200,Movie,Snow White and The Seven Dwarfs,David Hand,"Adriana Caselotti, Harry Stockwell, Lucille LaVerne, Moroni Olsen, Billy Gilbert, Pinto Colvig",United States,"November 12, 2019",1937.0,G,84 min,"Animation, Family, Fantasy",Discover the movie called “The Greatest Animated Film Of All Time”!,,,,,,
s1201,Movie,Snowball Express,Norman Tokar,"Dean Jones, Nancy Olson, Harry Morgan, Keenan Wynn, Johnny Whitaker, Michael McGreevy",United States,"November 12, 2019",1972.0,G,94 min,"Comedy, Family, Sports",A New York accountant moves west when he inherits a dilapidated ski resort.,,,,,,
s1202,Movie,Snowglobe,Ron Lagomarsino,"Christina Milian, Erin Karpluk, Hilda Doherty, Jason Schombing, James Kot, Andrew Krivanek",United States,"November 12, 2019",2007.0,TV-PG,90 min,"Comedy, Family, Fantasy",Angela finds a snow globe that transports her into a Christmas wonderland.,,,,,,
s1203,TV Show,So Weird,,"Cara DeLizia, Patrick Levis, Erik von Detten, Belinda Metz, Dave Ward, Mackenzie Phillips",Canada,"November 12, 2019",1999.0,TV-Y7,3 Seasons,"Fantasy, Kids, Mystery",A teenage girl travels the country on a rock tour while investigating the supernatural.,,,,,,
s1204,Movie,Society Dog Show,Bill Roberts,"Pinto Colvig, Walt Disney",United States,"November 12, 2019",1939.0,TV-G,9 min,"Animation, Comedy, Family","Pluto is out of place at a dog show, but he proves to be a hero. See details for advisory.",,,,,,
s1205,TV Show,Spider-Man (Shorts),,,,"November 12, 2019",2016.0,TV-Y7,1 Season,"Action-Adventure, Animation, Kids",Peter uses science to investigate his spider bite.,,,,,,
s1206,TV Show,Spider-Man and His Amazing Friends,,"Hans Conried, Jerry Dexter, George DiCenzo, Alan Dinehart, Walker Edminston, Michael Evans",United States,"November 12, 2019",1982.0,TV-Y7,1 Season,"Action-Adventure, Animation, Kids",Spider-Man battles crime in New York City with the help of Iceman and Firestar.,,,,,,
s1207,TV Show,Spider-Man Unlimited,,"Rino Romano, Kathleen Barr, Jim Byrnes, Garry Chalk, Paul Dobson","United States, Canada","November 12, 2019",1999.0,TV-Y7,1 Season,"Action-Adventure, Animation, Kids",Strap in to your seats and experience Spider-Man Unlimited!,,,,,,
s1208,TV Show,Spider-Woman,,"Joan Ark, Bruce Miller, Bryan Scott, Lou Krugman, Dick Tufeld",United States,"November 12, 2019",1979.0,TV-Y7,1 Season,"Action-Adventure, Animation, Kids",Jessica Drew has superhuman powers. She uses them as Spider-Woman.,,,,,,
s1209,TV Show,Star Wars Forces of Destiny (Shorts),,"Ashley Eckstein, Matt Lanter, C1-10P a.k.a. ""Chopper"" , John Boyega, Vanessa Marshall, Felicity Jones",United States,"November 12, 2019",2016.0,TV-Y7,2 Seasons,"Action-Adventure, Animation, Anthology",Untold stories from the heroines of Star Wars.,,,,,,
s1210,TV Show,Star Wars Rebels,,"Taylor Gray, Vanessa Marshall, Freddie Prinze Jr., Tiya Sircar, Steve Blum, C1-10P a.k.a. ""Chopper""",United States,"November 12, 2019",2014.0,TV-Y7,4 Seasons,"Action-Adventure, Animation, Kids",The Ghost crew provides a spark to ignite a rebellion.,,,,,,
s1211,TV Show,Star Wars Rebels (Shorts),,,,"November 12, 2019",2014.0,TV-Y7,1 Season,"Action-Adventure, Animation, Kids",It is a dark time in the galaxy as the Empire continues to tighten its grip.,,,,,,
s1212,Movie,Star Wars: A New Hope (Episode IV),George Lucas,"Mark Hamill, Harrison Ford, Carrie Fisher, Peter Cushing, Alec Guinness, Anthony Daniels",United States,"November 12, 2019",1977.0,PG,125 min,"Action-Adventure, Science Fiction",A young farm boy intercepts a distress call from the captive Princess Leia.,,,,,,
s1213,Movie,Star Wars: Attack of the Clones (Episode II),George Lucas,"Ewan McGregor, Natalie Portman, Hayden Christensen, Frank Oz, Ian McDiarmid, Pernilla August",United States,"November 12, 2019",2002.0,PG,143 min,"Action-Adventure, Science Fiction",Young Anakin and Padmé fall in love as galactic war looms.,,,,,,
s1214,TV Show,Star Wars: Blips,,,United States,"November 12, 2019",2019.0,TV-Y7-FV,1 Season,Series,What does a curious little droid do when he's not on a daring mission to save the galaxy?,,,,,,
s1215,Movie,Star Wars: Return of the Jedi (Episode VI),Richard Marquand,"Mark Hamill, Harrison Ford, Carrie Fisher, Billy Williams, Anthony Daniels, Peter Mayhew",United States,"November 12, 2019",1983.0,PG,135 min,"Action-Adventure, Science Fiction",Luke Skywalker faces Darth Vader in a final duel.,,,,,,
s1216,Movie,Star Wars: Revenge of the Sith (Episode III),George Lucas,"Ewan McGregor, Natalie Portman, Hayden Christensen, Ian McDiarmid, Frank Oz, Jimmy Smits",United States,"November 12, 2019",2005.0,PG-13,140 min,"Action-Adventure, Science Fiction","As the Republic falls, Anakin Skywalker becomes the evil Darth Vader.",,,,,,
s1217,Movie,Star Wars: The Empire Strikes Back (Episode V),Irvin Kershner,"Mark Hamill, Harrison Ford, Carrie Fisher, Billy Williams, Anthony Daniels, David Prowse",United States,"November 12, 2019",1980.0,PG,127 min,"Action-Adventure, Science Fiction",Luke Skywalker trains as a Jedi and confronts Darth Vader.,,,,,,
s1218,Movie,Star Wars: The Force Awakens (Episode VII),J.J. Abrams,"Harrison Ford, Mark Hamill, Carrie Fisher, Adam Driver, Daisy Ridley, John Boyega",United States,"November 12, 2019",2015.0,PG-13,139 min,"Action-Adventure, Science Fiction","Rey, Finn, Han and Chewbacca search for the one hope of restoring peace.",,,,,,
s1219,Movie,Star Wars: The Phantom Menace (Episode I),George Lucas,"Liam Neeson, Ewan McGregor, Natalie Portman, Jake Lloyd, Pernilla August, Frank Oz",United States,"November 12, 2019",1999.0,PG,136 min,"Action-Adventure, Science Fiction","Jedi discover Anakin Skywalker, a boy unusually strong in the Force.",,,,,,
s1220,Movie,Starstruck,Michael Grossman,"Sterling Knight, Danielle Campbell, Maggie Castle, Brandon Smith, Chelsea Staub, Beth Littleford",United States,"November 12, 2019",2010.0,TV-G,81 min,"Comedy, Coming of Age, Music",Pop star Christopher Wilde must choose to follow his heart or embrace fame.,,,,,,
s1221,Movie,Steamboat Willie,"Walt Disney, Ub Iwerks",Walt Disney,United States,"November 12, 2019",1928.0,TV-Y7,8 min,"Animation, Family, Kids",Watch Mickey Mouse's classic cartoon debut. See details for advisory.,,,,,,
s1222,Movie,Stepsister from Planet Weird,Steve Boyum,"Courtnee Draper, Tamara Hope, Lance Guest, Khrystyne Haje, Vanessa Chester, Myles Jeffrey",United States,"November 12, 2019",2000.0,TV-G,86 min,"Comedy, Family, Science Fiction",A human and an alien team up to stop their parents from getting married.,,,,,,
s1223,Movie,Stitch! The Movie,"Tony Craig, Bobs Gannaway","Daveigh Chase, Chris Sanders, Tia Carrere, David Stiers, Kevin McDonald, Ving Rhames",United States,"November 12, 2019",2003.0,G,62 min,"Animation, Comedy, Family","Stitch tries to save his intergalactic ""cousins"" from evil Captain Gantu.",,,,,,
s1224,Movie,Stonehenge Decoded: Secrets Revealed,Christopher Spencer,Craig Sechler,United Kingdom,"November 12, 2019",2008.0,TV-PG,44 min,Documentary,The discovery of a prehistoric site in Ireland sheds new light on the mysteries of Stonehenge,,,,,,
s1225,Movie,Stuck in the Suburbs,Savage Holland,"Danielle Panabaker, Brenda Song, Amanda Shaw, CiCi Hedgepeth, Jennie Garland, Ryan Belleville",United States,"November 12, 2019",2004.0,TV-G,79 min,"Comedy, Coming of Age, Music",A bored suburban teen accidentally switches phones with a pop star.,,,,,,
s1226,Movie,Sultan and the Rock Star,Ed Abroms,"Timothy Hutton, Ken Swofford, Bruce Glover, Ned Romero, Richard Paul, Pat Delany",United States,"November 12, 2019",1980.0,TV-PG,47 min,"Action-Adventure, Animals & Nature, Family",A rock star befriends a gentle tiger being hunted for sport. See details for advisory.,,,,,,
s1227,Movie,Super Buddies,Robert Vince,"Jeremy Shinder, Tenzing Trainor, Ty Panitz, G. Hannelius, Cooper Roth, Colin Hanks",United States,"November 12, 2019",2013.0,G,83 min,"Action-Adventure, Comedy, Family",A new breed of hero is born when Disney's favorite extraordinary pups become Super Buddies!,,,,,,
s1228,Movie,Swiss Family Robinson,Edward Ludwig,"Thomas Mitchell, Edna Best, Freddie Bartholomew, Terry Kilburn, Tim Holt, Baby Quillan",United States,"November 12, 2019",1940.0,PG,94 min,"Action-Adventure, Family, Survival",A violent storm shipwrecks the Robinson family on a deserted island. See details for advisory.,,,,,,
s1229,TV Show,TaleSpin,,"Charlie Adler, Jim Cummings, Ed Gilbert, Chuck McCann, Alan Roberts, Sally Struthers",United States,"November 12, 2019",1990.0,TV-G,1 Season,"Action-Adventure, Animation, Kids","Follow Baloo, his 12-year old navigator Kit, the boss Rebecca Cunningham, and the rest of the crew.",,,,,,
s1230,Movie,Tall Tale,Jeremiah Chechik,"Scott Glenn, Oliver Platt, Nick Stahl, Stephen Lang, Roger Brown, Jared Harris",United States,"November 12, 2019",1995.0,PG,97 min,"Action-Adventure, Western",It's all up to Pecos Bill to save a boy's family farm in this rousing Western adventure.,,,,,,
s1231,Movie,Tangled,"Nathan Greno, Byron Howard","Mandy Moore, Zachary Levi, Donna Murphy, Ron Perlman, M.C. Gainey, Jeffrey Tambor",United States,"November 12, 2019",2010.0,PG,101 min,"Action-Adventure, Animation, Family","Rapunzel and Flynn set off on a hilarious, hair-raising escapade.",,,,,,
s1232,Movie,Tangled Before Ever After,"Tom Caulfield, Stephen Sandoval","Zachary Levi, Mandy Moore, Eden Espinosa, Clancy Brown, Julie Bowen, Laura Benanti",United States,"November 12, 2019",2017.0,TV-Y7,58 min,"Animation, Coming of Age, Fantasy",Rapunzel escapes for a night of freedom before her coronation.,,,,,,
s1233,Movie,Tarzan & Jane,Steve Loter,"Michael Weiss, Olivia d'Abo, Rene Auberjonois, Jeff Bennett, Jim Cummings, Grey DeLisle",United States,"November 12, 2019",2002.0,TV-PG,78 min,"Action-Adventure, Animation",Tarzan and Jane celebrate their first year in the jungle.,,,,,,
s1234,Movie,Teacher's Pet,Timothy Björklund,"Nathan Lane, Kelsey Grammer, Shaun Fleming, Debra Rupp, David Stiers, Jerry Stiller",United States,"November 12, 2019",2004.0,PG,75 min,"Animation, Comedy, Family",A dog discovers that his dream of becoming a real boy isn't so far-fetched.,,,,,,
s1235,Movie,Teen Beach 2,Jeffrey Hornaday,"Ross Lynch, Maia Mitchell, Grace Phipps, Garrett Clayton, John DeLuca, Chrissie Fit",United States,"November 12, 2019",2015.0,TV-G,106 min,"Fantasy, Musical",Mack and Brady get a real-world visit from their retro movie compadres.,,,,,,
s1236,Movie,Teen Beach Movie,Jeffrey Hornaday,"Ross Lynch, Maia Mitchell, Grace Phipps, Garrett Clayton, John DeLuca, Chrissie Fit",United States,"November 12, 2019",2013.0,TV-G,97 min,"Coming of Age, Fantasy, Musical",McKenzie and her boyfriend Brady catch a wave into a retro coastal musical.,,,,,,
s1237,Movie,Teen Spirit,Gil Junger,"Cassie Scerbo, Lindsey Shaw, Chris Zylka, Tim Gunn, Carissa Capobianco, Gabriela Lopez",United States,"November 12, 2019",2011.0,TV-14,82 min,"Buddy, Comedy, Coming of Age","To save her soul, Amber must pull off a high-school miracle.",,,,,,
s1238,Movie,That Darn Cat,Bob Spiers,"Christina Ricci, Doug Doug, George Dzundza, Peter Boyle, Michael McKean, Bess Armstrong",United States,"November 12, 2019",1997.0,PG,90 min,"Animals & Nature, Comedy, Family","A teen, a cat and a rookie FBI agent team up to solve a kidnapping.",,,,,,
s1239,Movie,That Darn Cat!,Robert Stevenson,"Hayley Mills, Dean Jones, Dorothy Provine, Roddy McDowall, Neville Brand, Elsa Lanchester",United States,"November 12, 2019",1965.0,G,116 min,"Animals & Nature, Comedy, Family",A cat holds the clue to bank robbers holding a teller hostage.,,,,,,
s1240,Movie,The Absent-Minded Professor,Robert Stevenson,"Fred MacMurray, Nancy Olson, Keenan Wynn, Tommy Kirk, Leon Ames, Elliott Reid",United States,"November 12, 2019",1961.0,G,96 min,"Comedy, Family, Science Fiction",A bumbling professor invents gravity-defying Flubber.,,,,,,
